{
  "schemaVersion": 1,
  "generatedAt": "2026-07-28T23:58:58.025Z",
  "generatorVersion": "3.2.2",
  "owner": {
    "login": "JuanCarlosBP",
    "profileUrl": "https://github.com/JuanCarlosBP"
  },
  "projects": [
    {
      "id": "engineeringos",
      "name": "EngineeringOS",
      "repository": "JuanCarlosBP/portfolio",
      "repositoryUrl": "https://github.com/JuanCarlosBP/portfolio",
      "defaultBranch": "main",
      "status": "demonstrated",
      "category": "engineering system",
      "summary": "Sistema operativo personal de ingeniería para convertir trabajo en incrementos trazables, verificables y revisables.",
      "skills": [
        "GitHub Actions",
        "Python",
        "unittest",
        "ADR",
        "quality gates",
        "trazabilidad"
      ],
      "featured": true,
      "latestCommit": {
        "sha": "9bbc9cb39bafc1530d404561dbcb32054880cbfc",
        "shortSha": "9bbc9cb",
        "message": "feat(jcbp): install verified evidence feed automation (#5)",
        "date": "2026-07-28T23:58:41.000Z",
        "url": "https://github.com/JuanCarlosBP/portfolio/commit/9bbc9cb39bafc1530d404561dbcb32054880cbfc"
      },
      "latestMergedPullRequest": {
        "number": 5,
        "title": "feat(jcbp): install verified evidence feed automation",
        "mergedAt": "2026-07-28T23:58:41.000Z",
        "url": "https://github.com/JuanCarlosBP/portfolio/pull/5"
      },
      "latestRelease": null,
      "ci": {
        "workflowName": "EngineeringOS discovery quality",
        "workflowPath": ".github/workflows/engineeringos-discovery.yml",
        "branch": "main",
        "headSha": "b25bce5b44d4f276af3ad0bc21728243c9f03a7a",
        "matchesLatestCommit": false,
        "runId": 30136387462,
        "status": "unavailable",
        "conclusion": "success",
        "startedAt": "2026-07-25T00:29:13.000Z",
        "completedAt": "2026-07-25T00:29:29.000Z",
        "url": "https://github.com/JuanCarlosBP/portfolio/actions/runs/30136387462"
      },
      "evidence": {
        "repository": "https://github.com/JuanCarlosBP/portfolio",
        "issue": "https://github.com/JuanCarlosBP/portfolio/issues/1",
        "pullRequest": "https://github.com/JuanCarlosBP/portfolio/pull/2",
        "latestPullRequest": "https://github.com/JuanCarlosBP/portfolio/pull/5",
        "workflowRun": "https://github.com/JuanCarlosBP/portfolio/actions/runs/30136387462"
      },
      "updatedAt": "2026-07-28T23:58:41.000Z"
    }
  ],
  "apps": [],
  "repositories": [
    {
      "repository": "JuanCarlosBP/portfolio",
      "repositoryUrl": "https://github.com/JuanCarlosBP/portfolio",
      "defaultBranch": "main",
      "status": "active",
      "archived": false,
      "approvalSource": "registry",
      "updatedAt": "2026-07-25T22:10:59.000Z"
    }
  ],
  "activity": [
    {
      "type": "commit",
      "repository": "JuanCarlosBP/portfolio",
      "title": "feat(jcbp): install verified evidence feed automation (#5)",
      "occurredAt": "2026-07-28T23:58:41.000Z",
      "url": "https://github.com/JuanCarlosBP/portfolio/commit/9bbc9cb39bafc1530d404561dbcb32054880cbfc"
    },
    {
      "type": "pull_request",
      "repository": "JuanCarlosBP/portfolio",
      "title": "feat(jcbp): install verified evidence feed automation",
      "occurredAt": "2026-07-28T23:58:41.000Z",
      "url": "https://github.com/JuanCarlosBP/portfolio/pull/5"
    },
    {
      "type": "ci",
      "repository": "JuanCarlosBP/portfolio",
      "title": "EngineeringOS discovery quality: unavailable",
      "occurredAt": "2026-07-25T00:29:29.000Z",
      "url": "https://github.com/JuanCarlosBP/portfolio/actions/runs/30136387462"
    }
  ],
  "degraded": false,
  "errors": []
}
